<!ELEMENT KundenTbl (Kunde+)>
<!ELEMENT Kunde (ID, Vorname, Nachname, Strasse, HausNr, PLZ, Ort, Telefon?, eMail?, Branche)>

<!ELEMENT ID (#PCDATA)>
<!ELEMENT Vorname (#PCDATA)>
<!ELEMENT Nachname (#PCDATA)>
<!ELEMENT Strasse (#PCDATA)>
<!ELEMENT HausNr (#PCDATA)>
<!ELEMENT PLZ (#PCDATA)>
<!ELEMENT Ort (#PCDATA)>
<!ELEMENT Telefon (#PCDATA)>
<!ELEMENT eMail (#PCDATA)>
<!ELEMENT Branche (#PCDATA)>
